[
  {
    "avoidIf": "You need equity-like upside.",
    "bestUseCase": "Parking cash with minimal duration.",
    "currentYield": null,
    "dataAsOf": "2026-05-08",
    "dataConfidence": "high",
    "distributionDataAsOf": "2026-05-07",
    "distributionFrequency": "monthly",
    "distributionQuality": "strong",
    "distributionRate": null,
    "expenseRatio": 0.0009,
    "latestDistributionAmount": null,
    "latestDistributionDate": null,
    "mainRisks": [
      "Reinvestment if rates fall",
      "Not a credit hedge in a crisis"
    ],
    "marketPerformance1M": 0.0029,
    "marketPerformance3M": 0.0086,
    "marketPerformance1Y": 0.0407,
    "marketPerformance3Y": 0.0479,
    "marketPrice": 100.48,
    "name": "iShares 0-3 Month Treasury Bond ETF",
    "nav": 100.47,
    "navDataAsOf": "2026-05-08",
    "navPerformance1M": 0.003,
    "navPerformance3M": 0.0087,
    "navPerformance1Y": 0.0407,
    "navPerformance3Y": 0.048,
    "premiumDiscount": 0.0000995,
    "quarterlyFundamentalDataAsOf": "2026-03-31",
    "role": "Liquidity ballast and yield on idle cash.",
    "secYield": 0.0355,
    "sleeveType": "cash_tbills",
    "sourceLabel": "BlackRock iShares product page — SGOV (Key Facts to May 8, 2026; 30-day SEC yield May 7, 2026; NAV/market performance through Apr 30, 2026)",
    "sourceUrl": "https://www.ishares.com/us/products/314116/ishares-0-3-month-treasury-bond-etf",
    "structureLabel": "ETF",
    "ticker": "SGOV",
    "updateFrequency": "weekly",
    "yieldSource": "T-bill interest — short government paper."
  },
  {
    "avoidIf": "You cannot tolerate drawdowns.",
    "bestUseCase": "Sizing a modest junk sleeve with eyes open.",
    "currentYield": null,
    "dataAsOf": "2026-05-08",
    "dataConfidence": "high",
    "distributionDataAsOf": "2026-05-07",
    "distributionFrequency": "monthly",
    "distributionQuality": "mixed",
    "distributionRate": null,
    "expenseRatio": 0.0049,
    "latestDistributionAmount": null,
    "latestDistributionDate": null,
    "mainRisks": [
      "Default cycle drawdowns",
      "Spread widening"
    ],
    "marketPerformance1M": -0.0095,
    "marketPerformance3M": -0.0035,
    "marketPerformance1Y": 0.0689,
    "marketPerformance3Y": 0.079,
    "marketPrice": 80.14,
    "name": "iShares iBoxx $ High Yield Corporate Bond ETF",
    "nav": 80.204,
    "navDataAsOf": "2026-05-08",
    "navPerformance1M": -0.0104,
    "navPerformance3M": -0.0051,
    "navPerformance1Y": 0.0687,
    "navPerformance3Y": 0.0811,
    "premiumDiscount": -0.0008,
    "quarterlyFundamentalDataAsOf": "2026-03-31",
    "role": "Credit beta satellite around investment-grade core.",
    "secYield": 0.0643,
    "sleeveType": "credit_income",
    "sourceLabel": "BlackRock iShares product page — HYG (close May 8, 2026; implied NAV from published premium/discount May 7, 2026; SEC yield May 7, 2026; performance through Apr 30, 2026)",
    "sourceUrl": "https://www.ishares.com/us/products/239565/ishares-iboxx-high-yield-corporate-bond-etf",
    "structureLabel": "ETF",
    "ticker": "HYG",
    "updateFrequency": "weekly",
    "yieldSource": "Portfolio of high-yield corporate bonds — coupon-focused."
  },
  {
    "avoidIf": "You assume senior means safe in a recession.",
    "bestUseCase": "Rate-rise playbook alongside core bonds.",
    "currentYield": null,
    "dataAsOf": "2026-05-08",
    "dataConfidence": "low",
    "distributionDataAsOf": null,
    "distributionFrequency": "monthly",
    "distributionQuality": "mixed",
    "distributionRate": null,
    "expenseRatio": null,
    "estimatedReturnOfCapitalPct": null,
    "latestDistributionAmount": null,
    "latestDistributionDate": null,
    "leverage": null,
    "mainRisks": [
      "Credit deterioration if economy weakens",
      "Liquidity in stress"
    ],
    "marketPerformance1M": null,
    "marketPerformance3M": null,
    "marketPerformance1Y": null,
    "marketPerformance3Y": null,
    "marketPrice": null,
    "name": "Invesco Senior Loan ETF",
    "nav": null,
    "navDataAsOf": null,
    "navPerformance1M": null,
    "navPerformance3M": null,
    "navPerformance1Y": null,
    "navPerformance3Y": null,
    "premiumDiscount": null,
    "quarterlyFundamentalDataAsOf": null,
    "role": "Rate-hedge-ish credit sleeve; still lender risk.",
    "secYield": null,
    "sleeveType": "credit_income",
    "sourceLabel": "Invesco ETF product URL — BKLN (pricing/yields blocked by site session; use Invesco factsheet or SEC filings linked from product page)",
    "sourceUrl": "https://www.invesco.com/us/financial-products/etfs/product-detail?audienceType=Investor&productId=BKLN",
    "structureLabel": "ETF",
    "ticker": "BKLN",
    "updateFrequency": "weekly",
    "yieldSource": "Floating-rate senior loans — coupon resets with short rates."
  },
  {
    "avoidIf": "You want plain vanilla.",
    "bestUseCase": "Investors who accept structured-product homework.",
    "currentYield": null,
    "dataAsOf": "2026-05-08",
    "dataConfidence": "medium",
    "distributionDataAsOf": null,
    "distributionFrequency": "monthly",
    "distributionQuality": "mixed",
    "distributionRate": null,
    "expenseRatio": null,
    "estimatedReturnOfCapitalPct": null,
    "latestDistributionAmount": null,
    "latestDistributionDate": null,
    "leverage": null,
    "mainRisks": [
      "CLO complexity",
      "Underlying loan quality cycles"
    ],
    "marketPerformance1M": null,
    "marketPerformance3M": null,
    "marketPerformance1Y": null,
    "marketPerformance3Y": null,
    "marketPrice": null,
    "name": "Janus Henderson AAA CLO ETF",
    "nav": null,
    "navDataAsOf": null,
    "navPerformance1M": null,
    "navPerformance3M": null,
    "navPerformance1Y": null,
    "navPerformance3Y": null,
    "premiumDiscount": null,
    "quarterlyFundamentalDataAsOf": null,
    "role": "Higher carry than IG with structural subordination language to read.",
    "secYield": null,
    "sleeveType": "credit_income",
    "sourceLabel": "Janus Henderson investor product page — JAAA (overview in automated pull; verify yields/NAV on linked factsheet)",
    "sourceUrl": "https://www.janushenderson.com/en-us/investor/product/jaaa-aaa-clo-etf/?identifier=US47103U8457",
    "structureLabel": "ETF",
    "ticker": "JAAA",
    "updateFrequency": "weekly",
    "yieldSource": "Tranches of CLO debt — structured credit cash flows."
  },
  {
    "avoidIf": "You already have heavy credit risk elsewhere.",
    "bestUseCase": "Active credit satellite when you trust the process.",
    "currentYield": null,
    "dataAsOf": "2026-05-08",
    "dataConfidence": "medium",
    "distributionDataAsOf": "2026-05-08",
    "distributionFrequency": "monthly",
    "distributionQuality": "uncertain",
    "distributionRate": 0.1049767,
    "expenseRatio": 0.0526,
    "estimatedReturnOfCapitalPct": null,
    "latestDistributionAmount": 0.1125,
    "latestDistributionDate": null,
    "leverage": 0.4048,
    "mainRisks": [
      "Manager risk",
      "Liquidity mismatches",
      "Leverage"
    ],
    "marketPerformance1M": null,
    "marketPerformance3M": null,
    "marketPerformance1Y": null,
    "marketPerformance3Y": null,
    "marketPrice": 12.88,
    "name": "Ares Dynamic Credit Allocation Fund",
    "nav": 13.67,
    "navDataAsOf": "2026-05-07",
    "navPerformance1M": null,
    "navPerformance3M": null,
    "navPerformance1Y": null,
    "navPerformance3Y": null,
    "premiumDiscount": -0.0585,
    "quarterlyFundamentalDataAsOf": null,
    "role": "Actively managed credit sleeve with potential overlap to other holdings.",
    "secYield": null,
    "sleeveType": "cef_credit",
    "sourceLabel": "CEF Connect — ARDC (Nuveen/Morningstar): closing market price $12.88, NAV $13.67 (2026-05-07), premium/(discount) -5.85%; distribution $0.1125/mo, indicated distribution rate 10.49767%; effective leverage 40.48%; total expense ratio 5.26% (expense table as of 2025-10-31). Snapshot header dated 2026-05-08; verify on arespublicfunds.com filings.",
    "sourceUrl": "https://www.cefconnect.com/fund/ARDC",
    "structureLabel": "CEF",
    "ticker": "ARDC",
    "updateFrequency": "monthly",
    "yieldSource": "Flexible credit sleeve inside a closed-end fund — loans, bonds, CLOs; manager and leverage matter."
  },
  {
    "avoidIf": "You need FDIC safety.",
    "bestUseCase": "Part of a diversified income menu.",
    "currentYield": null,
    "dataAsOf": "2026-05-08",
    "dataConfidence": "high",
    "distributionDataAsOf": "2026-05-07",
    "distributionFrequency": "monthly",
    "distributionQuality": "mixed",
    "distributionRate": null,
    "expenseRatio": 0.0045,
    "estimatedReturnOfCapitalPct": null,
    "latestDistributionAmount": null,
    "latestDistributionDate": null,
    "leverage": null,
    "mainRisks": [
      "Rate resets",
      "Issuer-specific shocks",
      "Hybrid equity/bond behavior"
    ],
    "marketPerformance1M": -0.0338,
    "marketPerformance3M": -0.0142,
    "marketPerformance1Y": 0.0461,
    "marketPerformance3Y": 0.0539,
    "marketPrice": 31.52,
    "name": "iShares Preferred & Income Securities ETF",
    "nav": 31.5515,
    "navDataAsOf": "2026-05-07",
    "navPerformance1M": -0.0352,
    "navPerformance3M": -0.0175,
    "navPerformance1Y": 0.0463,
    "navPerformance3Y": 0.0535,
    "premiumDiscount": -0.001,
    "quarterlyFundamentalDataAsOf": "2026-03-31",
    "role": "Income tilt with rate and financial-sector concentration.",
    "secYield": 0.0634,
    "sleeveType": "preferred_income",
    "sourceLabel": "BlackRock iShares product page — PFF (close May 7, 2026; implied NAV from premium/discount; 30-day SEC yield Mar 31, 2026; expense ratio from prospectus table; performance through Apr 30, 2026)",
    "sourceUrl": "https://www.ishares.com/us/products/239826/ishares-preferred-and-income-securities-etf",
    "structureLabel": "ETF",
    "ticker": "PFF",
    "updateFrequency": "weekly",
    "yieldSource": "Preferred stock dividends (tax treatment varies)."
  },
  {